{
    "$schema": "https://json-schema.org/draft/2020-12/schema",
    "title": "Section",
    "description": "A section of the material in notes website.",
    "type": "object",
    "properties": {
        "$schema": {
            "description": "The schema used by this object.",
            "type": "string"
        },
        "title": {
            "description": "The title of this material section.",
            "type": "string"
        },
        "description": {
            "description": "The description of this material section.",
            "type": "string"
        },
        "pages": {
            "description": "All the pages in their specific order in the material section.",
            "type": "array",
            "items": {
                "type": "string"
            },
            "uniqueItems": true
        },
        "disabled": {
            "description": "A value indicating whether this material section is disabled or not.",
            "type": "boolean"
        }
    },
    "required": ["title", "description"],
    "additionalProperties": false
}